{
  "schemaVersion": 1,
  "taskId": "DEV-900071",
  "producedAt": "2026-08-18T00:00:00Z",
  "producer": "present-lease-broker deterministic acceptance",
  "workflowId": "DEV-900071-workflow",
  "workflowRunId": "wr-111111111111111111111111",
  "contractHash": "aaaaaaaaaaaaaaaaaaaaaaaaaaaaaaaaaaaaaaaaaaaaaaaaaaaaaaaaaaaaaaaa",
  "decision": "ACCEPTED",
  "reason": "verification evidence accepted",
  "acceptedEvidence": [
    {
      "id": "ev-verify",
      "nodeId": "verify",
      "role": "deterministic-acceptance",
      "status": "SUCCEEDED"
    }
  ]
}
